table_name,col_name,description
USVCTYP,ESTIMATION_TYPE,"Estimation Type. The type of estimation used for service, such as 'MONTH' or 'NOEST'."
USVCTYP,HALF_ADJUST_METERED_USAGE,Half-Adjust Metered Usage? Indicates if the metered usage is half-adjusted.
USVCTYP,INCLUDE_IN_USAGE_REPORTING,Include in Usage Reporting? Indicates if the service is included in usage reporting.
USVCTYP,METERED_SERVICE,Indicates if the service is metered. Datatype: CHAR
USVCTYP,METERED_USAGE_PRECISION,Precision level for metered usage. Datatype: SMALLINT
USVCTYP,METER_REQUIRED_FOR_USAGE_CALC,Specifies if a meter is required for usage calculation. Datatype: CHAR
USVCTYP,NAVIGATION_SUBSET_CODE,Navigation subset code for internal categorization. Datatype: CHAR
USVCTYP,OVERRIDE_USAGE_CALCULATION,Specifies if usage calculation is overridden. Datatype: CHAR
USVCTYP,PRE_BILL_SELECT_PROGRAM,Billing pre-selection program identifier. Datatype: CHAR
USVCTYP,READING_MULTIPLIER_PROGRAM,Program associated with reading multipliers. Datatype: CHAR
USVCTYP,SEASONAL_BASED_ON_SERVICE,Indicates if the service is seasonal based-on. Datatype: CHAR
USVCTYP,SERVICE_TYPE,Primary key representing the service type. Datatype: CHAR
USVCTYP,SORT_ORDER,Order in which services are sorted. Datatype: SMALLINT
USVCTYP,USAGE_YEAR_END_DAY,The day marking the end of the usage year. Datatype: DECIMAL
USVCTYP,USAGE_YEAR_END_MONTH,The month marking the end of the usage year. Datatype: DECIMAL
USVCTYP,USAGE_YEAR_START_DAY,The day marking the start of the usage year. Datatype: DECIMAL
USVCTYP,USAGE_YEAR_START_MONTH,The month marking the start of the usage year. Datatype: DECIMAL
USVCTYP,UTILITY_TYPE,"Type of utility service provided. E.g. W for water, G for gas, etc.. Datatype: CHAR"
USVCTYP,WARN_ON_DEVICE_COUNT_MISMATCH,Flag indicating warning on device count mismatch. Datatype: CHAR
UUSEHST,BILLING_UNIT_OF_MEASURE_TYPE,Type of unit of measure used for billing. Datatype: CHAR
UUSEHST,BILLING_USAGE,Usage amount billed against the usage period. Datatype: DECIMAL
UUSEHST,BILL_ID,Unique identifier for the bill. Datatype: DECIMAL
UUSEHST,CANCEL_REBILL_ORIGINAL_BILL_ID,Identifier for the original bill in case of cancellation/rebilling. Datatype: DECIMAL
UUSEHST,SERVICE_ID,Unique identifier for the service. Datatype: BIGINT
UUSEHST,STATUS_TYPE,"Status of the bill (e.g., Billed, Pending Cancellation). Datatype: CHAR"
UUSEHST,USAGE_ID,Unique identifier for the usage. Datatype: BIGINT
UUSEHST,USAGE_PERIOD," Represents the date or period associated with service usage. It indicates the specific month and year when the service usage was recorded. The format is YYYYMM, where 'YYYY' is the year and 'MM' is the month. This field is used to aggregate and analyze service usage over time. It is stored as a DECIMAL value to facilitate numerical operations and comparisons.. Datatype: DECIMAL"
UUSEHST,USAGE_TYPE,"Type of usage (e.g., Adjustment, Based-On). Datatype: CHAR"
UACTPRM,,This is the Account / Premises Agreement Table. This table is used to identify the association of the account and premises. Using the start and end date you can identify when each account moved in and moved out of a given premises.
UBLH,,"This table is the Bill History Summary table, it is used to store all the master data for the bill print history.  This detail includes account data such as name, Account ID, Customer ID, DBA, Bill Class, and Mailing address. It also includes Premises details such as service address. Along with a summary of charges and account balances."
UCLS,,This is the Bill Class Table. This is a configuration table to define the possible options for Bill Class and set any attributes related to that bill class type.
UPRM,,"This is the Master Premises Table. This table is used to store all the premises is in the database.  A Premises is a location where a utility company delivers a utility service such as electricity, natural gas, water, sewer, etc. This table also stores most of the premises attributes such as area, workzone, route, and dwelling type."
UPST,,This is the Premises Status Type Table. This is a configuration tables used to define the possible options for Premises Type and set any attributes related to that premises type.
URTE,,This is the Route Table. This is a configuration tables used to define the possible options for Route and set any attributes related to that route.  A route is a set of premises whose meters are read on the same day or part of a day by a single meter reader or meter reading crew using a single meter reading device or meter reading book.
URTESET,,This is the Route Set Table. This is a configuration tables used to define the possible options for Route Set and set any attributes related to that route set. A route set is more commonly referred to as a Cycle. A route set defines a group for routes that will be billed together in a Bill Cycle.
USERVICE,,"This is the Master Service Table. This table stores the master data related to a service that relates to all service types. Other child service tables will store data specific to unique service types. A Service is a utility offered at a premises, which is part of a service agreement that establishes the billing relationship between the customer account and the utility company. This table also include GPS location (longitude and latitude)"
USVCTYP,,This is the Service Type Table. This is a configuration tables used to define the possible options for Service Type and set any attributes related to that service type. This table will define billing configurate for each service type.
UUSEHST,,"This is the Usage History Table. This table is used as a repository for all usage available for billing, and as history of all billed usage.  It is the intent that the set of attributes contained in this table and any subordinate tables will provide a history of all factors used when calculating that usage."
